Пленницы	2013	триллер	Хью Джекман, Джейк Джилленхол	7.3	Отец берёт правосудие в свои руки.
Константин: Повелитель тьмы	2005	фэнтези	Киану Ривз, Рэйчел Вайс	7.3	Оккультист сражается с демонами.
Лицо со шрамом	1983	драма	Аль Пачино, Стивен Бауэр	7.3	Кубинский эмигрант строит криминальную империю.
Нечто	1982	ужасы	Курт Рассел, Кит Дэвид	7.3	Исследователи сталкиваются с инопланетным паразитом.
Белая птица: Новое чудо	2023	драма	Ариэлла Глейзер, Орландо Швердт	7.3	Девочка помогает однокласснику.
Люди в чёрном	1997	фантастика	Томми Ли Джонс, Уилл Смит	7.2	Агенты следят за инопланетянами.
Чудо	2017	драма	Джейкоб Тремблей, Оуэн Уилсон	7.2	Мальчик с редким заболеванием идёт в школу.
Сводишь с ума	2025	комедия	Мила Ершова, Юрий Насонов	7.2	Романтическая комедия о неожиданной любви.
Твоё имя	2016	аниме	Рюносукэ Камики, Монэ Камисираиси	7.2	Подростки меняются телами.
Выстрел в пустоту	2015	криминал	Николай Костер-Вальдау, Омари Хардвик	7.2	Банкир становится лидером банды в тюрьме.
Терминатор	1984	фантастика	Арнольд Шварценеггер, Майкл Бин	7.2	Киборг охотится на Сару Коннор.
Уроки фарси	2020	драма	Науэль Перес Бискаярт, Ларс Айдингер	7.2	Заключённый выживает в концлагере.
Группа крови	2025	военный	Андрей Рудыка, Ева Уильямс	7.2	Молодые бойцы проходят через войну.
Экипаж	2016	драма	Данила Козловский, Владимир Машков	7.2	Пилоты спасают пассажиров при посадке.
Таксист	2017	история	Сон Кан-хо, Томас Кречман	7.2	Водитель помогает журналисту во время восстания.
Мотылёк	2017	криминал	Чарли Ханнэм, Рами Малек	7.2	Заключённые пытаются сбежать.
Творение Господне	2004	драма	Ясин Бей, Алан Рикман	7.2	Врачи совершают прорыв в хирургии.
Бешеные псы	1991	криминал	Харви Кейтель, Тим Рот	7.2	Грабители подозревают предателя.
Три билборда на границе Эббинга, Миссури	2017	драма	Фрэнсис Макдорманд, Сэм Рокуэлл	7.2	Мать требует найти убийц дочери.
Пальма	2020	семейный	Виктор Добронравов, Лили	7.2	Собака ждёт хозяина.
Чего хотят женщины	2000	мелодрама	Мэл Гибсон, Хелен Хант	7.2	Мужчина слышит мысли женщин.
День сурка	1993	фэнтези	Билл Мюррей, Энди Макдауэлл	7.2	Телеведущий застревает в одном дне.
Курьер	1986	драма	Федор Дунаевский, Анастасия Немоляева	7.2	Молодой курьер бунтует против системы.
Хоббит: Пустошь Смауга	2013	фэнтези	Мартин Фриман, Ричард Армитедж	7.2	Гномы идут к Одинокой горе.
Чужие	1986	ужасы	Сигурни Уивер, Майкл Бин	7.2	Рипли сражается с ксеноморфами.
Земмельвейс	2023	драма	Миклош Х. Вечеи, Катица Надь	7.2	Врач борется с детской смертностью.
Приходи на меня посмотреть	2000	мелодрама	Олег Янковский, Ирина Купченко	7.2	Влюблённые переживают разлуку.
Воин	2011	драма	Джоэл Эдгертон, Том Харди	7.2	Братья сходятся на ринге.
Римские каникулы	1953	мелодрама	Грегори Пек, Одри Хепберн	7.2	Принцесса влюбляется в журналиста.
Запах женщины	1992	драма	Аль Пачино, Крис О’Доннелл	7.2	Слепой полковник учит юношу ценить жизнь.
Назад в будущее 3	1990	фантастика	Майкл Дж. Фокс, Кристофер Ллойд	7.2	Марти и Док на Диком Западе.
Нефть	2007	драма	Дэниэл Дэй-Льюис, Пол Дано	7.2	Нефтяной магнат одержим властью.
Однажды в Америке	1983	драма	Роберт Де Ниро, Джеймс Вудс	7.2	Друзья детства становятся гангстерами.
Такси 2	2000	боевик	Сами Насери, Фредерик Дифенталь	7.2	Таксист снова помогает полиции.
Шерлок Холмс и доктор Ватсон: Смертельная схватка	1980	криминал	Василий Ливанов, Виталий Соломин	7.2	Холмс раскрывает дело Мориарти.
Умница Уилл Хантинг	1997	драма	Мэтт Дэймон, Робин Уильямс	7.2	Гений-уборщик открывает потенциал.
Гараж	1979	драма	Валентин Гафт, Ия Саввина	7.2	Владельцы гаражей решают, кого исключить.
Карнавальная ночь	1956	комедия	Игорь Ильинский, Людмила Гурченко	7.2	Новогодний вечер в клубе.
Ип Ман	2008	биография	Донни Йен, Саймон Ям	7.2	Мастер учит Ип Мана перед войной.
Брат 2	2000	боевик	Сергей Бодров мл., Виктор Сухоруков	8.2	Данила Багров отправляется в Америку.
Пианист	2002	драма	Эдриен Броуди, Томас Кречман	8.5	Польский пианист выживает в Варшаве.
Спасти рядового Райана	1998	военный	Том Хэнкс, Том Сайзмор	8.6	Солдаты ищут парашютиста в Нормандии.
Дюна: Часть вторая	2024	фантастика	Тимоти Шаламе, Зендея	8.5	Пол Атрейдес объединяется с фрименами.
Жизнь прекрасна	1997	драма	Роберто Бениньи, Николетта Брасчи	8.6	Отец скрывает ужасы концлагеря от сына.
Амели	2001	мелодрама	Одри Тоту, Матьё Кассовиц	8.2	Застенчивая официантка меняет жизнь людей в Париже.
Заводной апельсин	1971	фантастика	Малкольм Макдауэлл, Патрик Мейги	8.1	Лидер банды проходит экспериментальную реабилитацию.
В джазе только девушки	1959	комедия	Мэрилин Монро, Тони Кёртис	8.5	Музыканты переодеваются в женщин.
Миллионер из трущоб	2008	криминал	Дев Патель, Фрида Пинто	8.1	Сирота выигрывает викторину и вспоминает любовь.
Исчезнувшая	2014	триллер	Бен Аффлек, Розамунд Пайк	8.0	Мужа подозревают в исчезновении жены.
Бегущий по лезвию 2049	2017	фантастика	Харрисон Форд, Райан Гослинг	7.8	Офицер ищет бывшего коллегу в Лос-Анджелесе.
